[
  {
    "id": "book-open-source-detail-valid",
    "event": "book.open",
    "effectType": "source.detail",
    "valid": true,
    "result": {}
  },
  {
    "id": "book-open-source-detail-unknown",
    "event": "book.open",
    "effectType": "source.detail",
    "valid": false,
    "result": {
      "__unknown": true
    }
  },
  {
    "id": "book-open-chapter-list-valid",
    "event": "book.open",
    "effectType": "chapter.list",
    "valid": true,
    "result": {
      "chapterCount": 3
    }
  },
  {
    "id": "book-open-chapter-list-unknown",
    "event": "book.open",
    "effectType": "chapter.list",
    "valid": false,
    "result": {
      "chapterCount": 3,
      "__unknown": true
    }
  },
  {
    "id": "book-open-content-load-valid",
    "event": "book.open",
    "effectType": "content.load",
    "valid": true,
    "result": {}
  },
  {
    "id": "book-open-content-load-unknown",
    "event": "book.open",
    "effectType": "content.load",
    "valid": false,
    "result": {
      "__unknown": true
    }
  },
  {
    "id": "book-open-reader-location-resolve-valid",
    "event": "book.open",
    "effectType": "reader.location.resolve",
    "valid": true,
    "result": {
      "canonicalLocation": {
        "bookId": "book-1",
        "chapterIndex": 1,
        "chapterOffset": 0,
        "chapterProgress": 0,
        "locationRevision": "reader-location-v1:book-1:1:0"
      },
      "resolverVersion": "reader.location.resolve.v1.reflow",
      "resolved": true,
      "reflow": {
        "strategy": "offsetAnchor",
        "primaryAnchor": "chapterOffset",
        "fallbackAnchor": "chapterProgress",
        "layoutIndependent": true
      }
    }
  },
  {
    "id": "book-open-reader-location-resolve-unknown",
    "event": "book.open",
    "effectType": "reader.location.resolve",
    "valid": false,
    "result": {
      "canonicalLocation": {
        "bookId": "book-1",
        "chapterIndex": 1,
        "chapterOffset": 0,
        "chapterProgress": 0,
        "locationRevision": "reader-location-v1:book-1:1:0"
      },
      "resolverVersion": "reader.location.resolve.v1.reflow",
      "resolved": true,
      "reflow": {
        "strategy": "offsetAnchor",
        "primaryAnchor": "chapterOffset",
        "fallbackAnchor": "chapterProgress",
        "layoutIndependent": true
      },
      "__unknown": true
    }
  },
  {
    "id": "book-open-tts-system-stop-valid",
    "event": "book.open",
    "effectType": "tts.system.stop",
    "valid": true,
    "result": {
      "acknowledged": true
    }
  },
  {
    "id": "book-open-tts-system-stop-unknown",
    "event": "book.open",
    "effectType": "tts.system.stop",
    "valid": false,
    "result": {
      "acknowledged": true,
      "__unknown": true
    }
  },
  {
    "id": "book-open-tts-queue-stop-valid",
    "event": "book.open",
    "effectType": "tts.queue.stop",
    "valid": true,
    "result": {}
  },
  {
    "id": "book-open-tts-queue-stop-unknown",
    "event": "book.open",
    "effectType": "tts.queue.stop",
    "valid": false,
    "result": {
      "__unknown": true
    }
  },
  {
    "id": "book-open-timer-foreground-cancel-valid",
    "event": "book.open",
    "effectType": "timer.foreground.cancel",
    "valid": true,
    "result": {
      "cancelled": true,
      "timerId": "timer-1",
      "generation": 1
    }
  },
  {
    "id": "book-open-timer-foreground-cancel-unknown",
    "event": "book.open",
    "effectType": "timer.foreground.cancel",
    "valid": false,
    "result": {
      "cancelled": true,
      "timerId": "timer-1",
      "generation": 1,
      "__unknown": true
    }
  },
  {
    "id": "reader-exit-tts-system-stop-valid",
    "event": "reader.exit",
    "effectType": "tts.system.stop",
    "valid": true,
    "result": {
      "acknowledged": true
    }
  },
  {
    "id": "reader-exit-tts-system-stop-unknown",
    "event": "reader.exit",
    "effectType": "tts.system.stop",
    "valid": false,
    "result": {
      "acknowledged": true,
      "__unknown": true
    }
  },
  {
    "id": "reader-exit-tts-queue-stop-valid",
    "event": "reader.exit",
    "effectType": "tts.queue.stop",
    "valid": true,
    "result": {}
  },
  {
    "id": "reader-exit-tts-queue-stop-unknown",
    "event": "reader.exit",
    "effectType": "tts.queue.stop",
    "valid": false,
    "result": {
      "__unknown": true
    }
  },
  {
    "id": "reader-exit-timer-foreground-cancel-valid",
    "event": "reader.exit",
    "effectType": "timer.foreground.cancel",
    "valid": true,
    "result": {
      "cancelled": true,
      "timerId": "timer-1",
      "generation": 1
    }
  },
  {
    "id": "reader-exit-timer-foreground-cancel-unknown",
    "event": "reader.exit",
    "effectType": "timer.foreground.cancel",
    "valid": false,
    "result": {
      "cancelled": true,
      "timerId": "timer-1",
      "generation": 1,
      "__unknown": true
    }
  },
  {
    "id": "reader-page-next-reader-location-resolve-valid",
    "event": "reader.page.next",
    "effectType": "reader.location.resolve",
    "valid": true,
    "result": {
      "canonicalLocation": {
        "bookId": "book-1",
        "chapterIndex": 1,
        "chapterOffset": 0,
        "chapterProgress": 0,
        "locationRevision": "reader-location-v1:book-1:1:0"
      },
      "resolverVersion": "reader.location.resolve.v1.reflow",
      "resolved": true,
      "reflow": {
        "strategy": "offsetAnchor",
        "primaryAnchor": "chapterOffset",
        "fallbackAnchor": "chapterProgress",
        "layoutIndependent": true
      }
    }
  },
  {
    "id": "reader-page-next-reader-location-resolve-unknown",
    "event": "reader.page.next",
    "effectType": "reader.location.resolve",
    "valid": false,
    "result": {
      "canonicalLocation": {
        "bookId": "book-1",
        "chapterIndex": 1,
        "chapterOffset": 0,
        "chapterProgress": 0,
        "locationRevision": "reader-location-v1:book-1:1:0"
      },
      "resolverVersion": "reader.location.resolve.v1.reflow",
      "resolved": true,
      "reflow": {
        "strategy": "offsetAnchor",
        "primaryAnchor": "chapterOffset",
        "fallbackAnchor": "chapterProgress",
        "layoutIndependent": true
      },
      "__unknown": true
    }
  },
  {
    "id": "reader-page-next-reader-progress-update-valid",
    "event": "reader.page.next",
    "effectType": "reader.progress.update",
    "valid": true,
    "result": {
      "stored": true
    }
  },
  {
    "id": "reader-page-next-reader-progress-update-error",
    "event": "reader.page.next",
    "effectType": "reader.progress.update",
    "valid": true,
    "result": {
      "error": "PROGRESS_STORE_FAILED"
    }
  },
  {
    "id": "reader-page-next-reader-progress-update-false",
    "event": "reader.page.next",
    "effectType": "reader.progress.update",
    "valid": false,
    "result": {
      "stored": false
    }
  },
  {
    "id": "reader-page-next-reader-progress-update-unknown",
    "event": "reader.page.next",
    "effectType": "reader.progress.update",
    "valid": false,
    "result": {
      "stored": true,
      "__unknown": true
    }
  },
  {
    "id": "reader-page-next-timer-foreground-cancel-valid",
    "event": "reader.page.next",
    "effectType": "timer.foreground.cancel",
    "valid": true,
    "result": {
      "cancelled": true,
      "timerId": "timer-1",
      "generation": 1
    }
  },
  {
    "id": "reader-page-next-timer-foreground-cancel-unknown",
    "event": "reader.page.next",
    "effectType": "timer.foreground.cancel",
    "valid": false,
    "result": {
      "cancelled": true,
      "timerId": "timer-1",
      "generation": 1,
      "__unknown": true
    }
  },
  {
    "id": "reader-page-prev-reader-location-resolve-valid",
    "event": "reader.page.prev",
    "effectType": "reader.location.resolve",
    "valid": true,
    "result": {
      "canonicalLocation": {
        "bookId": "book-1",
        "chapterIndex": 1,
        "chapterOffset": 0,
        "chapterProgress": 0,
        "locationRevision": "reader-location-v1:book-1:1:0"
      },
      "resolverVersion": "reader.location.resolve.v1.reflow",
      "resolved": true,
      "reflow": {
        "strategy": "offsetAnchor",
        "primaryAnchor": "chapterOffset",
        "fallbackAnchor": "chapterProgress",
        "layoutIndependent": true
      }
    }
  },
  {
    "id": "reader-page-prev-reader-location-resolve-unknown",
    "event": "reader.page.prev",
    "effectType": "reader.location.resolve",
    "valid": false,
    "result": {
      "canonicalLocation": {
        "bookId": "book-1",
        "chapterIndex": 1,
        "chapterOffset": 0,
        "chapterProgress": 0,
        "locationRevision": "reader-location-v1:book-1:1:0"
      },
      "resolverVersion": "reader.location.resolve.v1.reflow",
      "resolved": true,
      "reflow": {
        "strategy": "offsetAnchor",
        "primaryAnchor": "chapterOffset",
        "fallbackAnchor": "chapterProgress",
        "layoutIndependent": true
      },
      "__unknown": true
    }
  },
  {
    "id": "reader-page-prev-reader-progress-update-valid",
    "event": "reader.page.prev",
    "effectType": "reader.progress.update",
    "valid": true,
    "result": {
      "stored": true
    }
  },
  {
    "id": "reader-page-prev-reader-progress-update-error",
    "event": "reader.page.prev",
    "effectType": "reader.progress.update",
    "valid": true,
    "result": {
      "error": "PROGRESS_STORE_FAILED"
    }
  },
  {
    "id": "reader-page-prev-reader-progress-update-false",
    "event": "reader.page.prev",
    "effectType": "reader.progress.update",
    "valid": false,
    "result": {
      "stored": false
    }
  },
  {
    "id": "reader-page-prev-reader-progress-update-unknown",
    "event": "reader.page.prev",
    "effectType": "reader.progress.update",
    "valid": false,
    "result": {
      "stored": true,
      "__unknown": true
    }
  },
  {